{"$schema":"../../schemas/recipe-fragment.schema.v1.json","schemaVersion":"1.0","fragmentId":"fragment.regex-extract-after-separator","title":"Текст после разделителя","externalInputs":[{"id":"text","type":"STRING","to":"extract","input":"string"}],"nodes":[{"ref":"extract","classType":"RegexExtract","role":"Извлечь первую группу после строки ---","settings":{"regex_pattern":"(?s)(?<=\\n---\\n)([\\s\\S]*)$","mode":"First Group","case_insensitive":true,"multiline":false,"dotall":false,"group_index":1}}],"connections":[]}
