{"$schema":"../../schemas/recipe-fragment.schema.v1.json","schemaVersion":"1.0","fragmentId":"fragment.clip-text-encode-lumina2-local-check","title":"CLIPTextEncodeLumina2: системная инструкция Lumina 2: локальная проверочная заготовка","externalInputs":[{"id":"system_prompt","type":"COMBO","to":"target","input":"system_prompt"},{"id":"clip","type":"CLIP","to":"target","input":"clip"}],"nodes":[{"ref":"target","classType":"CLIPTextEncodeLumina2","role":"Проверить входы ноды в локальном графе","settings":{"user_prompt":""}}],"connections":[]}
