{"$schema":"../../schemas/recipe-fragment.schema.v1.json","schemaVersion":"1.0","fragmentId":"fragment.model-patch-loader-local-check","title":"ModelPatchLoader: загрузчик специализированных патчей модели: локальная проверочная заготовка","externalInputs":[],"nodes":[{"ref":"target","classType":"ModelPatchLoader","role":"Проверить входы ноды в локальном графе","settings":{}}],"connections":[]}
