{
  "$schema": "../../schemas/recipe-fragment.schema.v1.json",
  "schemaVersion": "1.0",
  "fragmentId": "fragment.default-fallback-conditioning",
  "title": "Обычный cond и default fallback",
  "externalInputs": [
    { "id": "cond", "type": "CONDITIONING", "to": "default_combine", "input": "cond" },
    { "id": "cond_default", "type": "CONDITIONING", "to": "default_combine", "input": "cond_DEFAULT" }
  ],
  "nodes": [
    {
      "ref": "default_combine",
      "classType": "ConditioningSetDefaultCombine",
      "role": "Пометить второй список default и объединить с обычным",
      "settings": {}
    }
  ],
  "connections": []
}
