{
  "$schema": "../../schemas/recipe-fragment.schema.v1.json", "schemaVersion": "1.0", "fragmentId": "fragment.merge-flux1-first-double-block", "title": "Flux.1 double block 0: 50/50",
  "externalInputs": [{"id": "model1", "type": "MODEL", "to": "merge", "input": "model1"}, {"id": "model2", "type": "MODEL", "to": "merge", "input": "model2"}],
  "nodes": [{"ref": "merge", "classType": "ModelMergeFlux1", "role": "Смешать первый double block пополам; остальные runtime defaults равны 1", "settings": {"double_blocks.0.": 0.5}}], "connections": []
}
