{"$schema":"../../schemas/recipe-fragment.schema.v1.json","schemaVersion":"1.0","fragmentId":"fragment.da3-geometry-mesh","title":"DA3_GEOMETRY в текстурированную сетку","externalInputs":[{"id":"geometry","type":"DA3_GEOMETRY","to":"mesh","input":"da3_geometry"}],"nodes":[{"ref":"mesh","classType":"DA3GeometryToMesh","role":"Развернуть глубину и построить MESH","settings":{"batch_index":0,"decimation":1,"discontinuity_threshold":0.04,"confidence_threshold":0.1,"use_sky_mask":true,"texture":true}}],"connections":[]}
