{
  "$schema": "../../schemas/recipe-fragment.schema.v1.json",
  "schemaVersion": "1.0",
  "fragmentId": "fragment.save-image-data-set-increment",
  "title": "SaveImageDataSetToFolder в режиме increment",
  "externalInputs": [
    {
      "id": "images",
      "type": "IMAGE",
      "to": "saver",
      "input": "images"
    }
  ],
  "nodes": [
    {
      "ref": "saver",
      "classType": "SaveImageDataSetToFolder",
      "role": "Записать списочные изображения как восьмибитные PNG",
      "settings": {
        "folder_name": "dataset",
        "filename_prefix": "image",
        "mode": "increment"
      }
    }
  ],
  "connections": []
}
